160,Argentina,Protest against cuts to higher education budget,24-Apr,Free,"President Javier Milei has implemented a number of spending cuts that have led to mass layoffs, including cuts to fuel and transportation subsidies. Milei has now cut the budget of public universities.","Demand that Milei increase funding for higher education, which is largely dependent upon government subsidies. Protesters believe that the budget cuts threaten not only the livelihoods of university faculty, but also the sustainability of the public education system.",">100,000","General public, university students and teachers",1 day in April 2024; 1 month in October 2024,"No policy/leadership change in response to protests. On October 3, Milei vetoed a law passed by Congress that would have increased funding for universities, sparking another wave of protests.",Yes,Yes,Yes,No,No,Hundreds of thousands,No,Yes,No,No,No,Buenos Aires,2024,4,01-04-24,160,1,100000,2024,4,2024Q2,Normal,"general public, university students and teachers",students/youth
161,Russia,Protest for Ural flood relief,24-Apr,Not free,"A dam broke in the southwestern Ural region, flooding over 10,000 homes. The regional government is providing monthly payments of about $100 to flood victims for the next six months, which protesters say is insufficient.","Residents demanded compensation for the flooding of their homes. Protesters chanted ""Putin help us"" and labeled the government a ""shame"" for not providing adequate financial support.",>100,Ural region residents,1 day,No policy or leadership change in response to the protests.,No,Yes,Yes,No,No,Hundreds,No,No,No,No,No,Moscow,2024,4,01-04-24,161,1,100,2024,4,2024Q2,Normal,ural region residents,local communities
162,Benin,Cost of living protests,24-Apr,Partly free,"Prices of staple crops such as corn, garri flour, beans, and cowpeas have risen in recent months. The IMF reported in April 2024 that incomes in sub-Saharan Africa are falling further behind the rest of the world amid tepid economic growth.",Demand government assistance to help residents facing rising costs.,>100,Trade unions,1 day,No policy or leadership change in response to the protests.,No,Yes,No,No,No,Hundreds,No,No,No,No,No,Porto-Novo,2024,4,01-04-24,162,1,100,2024,4,2024Q2,Normal,trade unions,labor unions
163,Mexico,Ayotzinapa students' protest for justice,24-Apr,Partly free,"In 2014, forty-three male students at a teachers' college in Iguala, Guerrero, were kidnapped and—as later revealed—killed after they commandeered buses for an annual drive to Mexico City to mark the 1968 Tlatelolco massacre. A 2022 truth commission concluded that the disappearance was a ""state crime"" which involved local, state, and federal authorities. Another student was killed in March 2024 during a confrontation with police. The police officers responsible for that student's death are under investigation.",Demand justice for the forty-three students kidnapped in 2014 and accountability for their slain classmates.,>100,Students at the Ayotzinapa teachers' college,1 day,No policy or leadership change in response to the protests.,No,No,Yes,No,No,Hundreds,No,No,No,No,No,Mexico City,2024,4,01-04-24,163,1,100,2024,4,2024Q2,Normal,students at the ayotzinapa teachers' college,students/youth
164,Brazil,Free Land Camp protest against grain railway,24-Apr,Free,"The government plans to build a railway to transport grain from farm states to Amazon ports for export, which members of the Indigenous community say will destroy the environment of tribal communities. This coincided with the week-long twentieth annual Free Land Camp, in which indigenous communities enact encampments in Brasilia as a form of protest against government wrongdoings.",Protest against the proposed railroad. Criticize President Luiz Inácio Lula da Silva for not fulfilling his promises to officially recognize Indigenous reservations and expel illegal miners and land-grabbers from their territory.,">1,000",Indigenous community,1 week,No policy or leadership change in response to the protests.,No,Yes,Yes,No,No,Thousands,No,No,No,No,No,Brasilia,2024,4,01-04-24,164,7,1000,2024,4,2024Q2,Normal,indigenous community,minority/ethnic group
165,Pakistan,2024 election protests,Feb-24,Partly free,"Imran Khan's Pakistan Tehreek-e Insaf (PTI) party won a plurality of seats in the February 8 parliamentary elections, but two rival parties—Nawaz Sharif’s Pakistan Muslim League-Nawaz and Bilawal Bhutto Zardari’s Pakistan People’s Party—are working to reach an agreement to form a coalition government. Khan could not run in the election due to criminal convictions against him, which he claims are politically motivated.",Protesters from Khan's party say the election results were manipulated—though the Election Commission of Pakistan denies these allegations.,">1,000","PTI supporters, PTI officials",1 month; 1 day in February 2025,"No policy/leadership change in response to protests. Despite protests, the new parliament swore in on February 29, 2024.",No,No,Yes,No,No,Thousands,No,No,Yes,No,No,Islamabad,2024,2,01-02-24,165,30,1000,2024,2,2024Q1,Normal,"pti supporters, pti officials",political group
166,Cuba,Food and power shortages protests,Mar-24,Not free,The country is experiencing power cuts and shortages of food and medicine. There has also been a decline in living conditions on par with that following the collapse of the Soviet Union. The power outages were exacerbated by two hurricanes that struck Cuba in October 2024.,Express discontent with the government due to its inability to provide services for its citizenry. Protesters also called for an end to communism and for President Miguel Díaz-Canel's resignation.,>100,General public,2 days; 3 weeks from October - November 2024,No policy/leadership change in response to protests. Cuban authorities announced in November 2024 that they had arrested several protestors for disorderly conduct.,No,Yes,Yes,No,No,Hundreds,No,No,No,No,No,Havana,2024,3,01-03-24,166,2,100,2024,3,2024Q1,Normal,general public,public
167,Germany,Anti-AfD protest,24-Jan,Free,Reports that a group of officials from the Alternative for Germany (AfD) party met with neo-Nazis at a hotel in Potsdam to discuss the possibility of a mass deportation scheme. Holocaust Memorial Day. Regional elections. The AfD is polling in second place in Germany for the June 2024 European Parliament elections.,Denounce the AfD and Nazism.,">2,400,000",General public,6 months; 1 week in August 2024,"No policy/leadership change in response to the protests. The AfD lost a runoff election in the Saale-Orla district of Thuringia on January 28, 2024. In the June 2024 elections, the AfD won the second-highest number of seats in the EU. In September 2024, the AfD earned nearly one-third of the votes in Thuringia's state election and became the largest party in the state parliament.",No,No,Yes,No,No,Millions,No,Yes,No,Yes,No,Berlin,2024,1,01-01-24,167,180,2400000,2024,1,2024Q1,Outlier,general public,public
168,Senegal,Election delay protests,Feb-24,Partly free,"President Macky Sall abruptly postponed elections scheduled for February 2024 until December 2024. This was done after police expelled opposition members from the National Assembly, prohibiting them from voting against the postponement of the election, which passed by a vote of 105 to 1.",Denounce what is seen by many as an institutional coup initiated by an unpopular president in an attempt to stay in power.,">1,000","General public, opposition",1 month,"On February 15, 2024, Senegal's Constitutional Council ruled that the election delay was unlawful. The election was held on March 24, 2024, and won by opposition candidate Bassirou Diomaye Faye.",No,No,Yes,No,No,Thousands,Yes,No,Yes,No,No,Dakar,2024,2,01-02-24,168,30,1000,2024,2,2024Q1,Normal,"general public, opposition",public
169,Israel,Anti-Netanyahu protests,24-Jan,Free,"Ongoing Israel-Hamas war, which some Israelis assert Prime Minister Benjamin Netanyahu is mishandling.","Demand a change of government and the ousting of Netanyahu. In late March 2024, protests intensified as demonstrators called for immediate elections and for a ceasefire deal to secure the release of hostages held by Hamas in Gaza.",">10,000",General public,Active,No policy/leadership change in response to the protests.,Yes,No,Yes,No,No,Tens of thousands,No,No,Yes,Yes,No,Jerusalem,2024,1,01-01-24,169,468,10000,2024,1,2024Q1,Outlier,general public,public
170,Finland,Labor law change protest,23-Dec,Free,"Prime Minister Petteri Orpo, described as pro-business, sought to make the country's terms of employment more flexible and cut unemployment.","Public transportation workers, manufacturing workers, and their unions went on a twenty-four-hour strike in December 2023 in protest of the law changes. This was followed by weeks-long strikes beginning in February 2024.",">100,000","Public transit workers, unions",1 day in December 2023; active February 2024 through April 2024,"No policy/leadership change in response to protest. The protesters suspended the March 2024 strike in early April 2024, in hopes that the suspension will lead to negotiations with the government.",No,Yes,No,No,No,Hundreds of thousands,No,Yes,No,No,No,Helsinki,2023,12,01-12-23,170,1,100000,2023,12,2023Q4,Normal,"public transit workers, unions",labor unions
171,Poland,Farmers' protest,Jan-24,Free,"The EU waived duties and quotas for imports from Ukraine, which put pressure on prices for EU farmers, who must follow EU environmental standards. Ongoing negotiations for a trade deal between the EU and the South American Mercosur bloc. New EU environmental regulations, including new subsidy rules which require 4 percent of farmland to be fallow.","Protest against EU environmental regulations and cheap food imports, specifically from Ukraine.",">10,000",Farmers,4 months; 1 day in Jan 2025,"Prime Minister Donald Tusk said on February 27, 2024, that he could not rule out widening a national ban on Ukrainian grain imports if the EU does not act to protect the EU market. Tusk and President Andrzej Duda also spoke to protesters in Prague, where they said the EU must implement policy changes to protect EU farmers. On March 15, the EU proposed legislation which, if passed, will ease the environmental rules of the Common Agricultural Policy. The Polish government plans to pay $522 million in subsidies to farmers to compensate them for low market prices for grain.",No,Yes,Yes,No,No,Tens of thousands,Yes,No,No,Yes,No,Warsaw,2024,1,01-01-24,171,120,10000,2024,1,2024Q1,Normal,farmers,agriculture workers
172,Israel,Protest against ultra-Orthodox conscription,Mar-24,Free,"The government announced on March 28, 2024, that it had not agreed on an extension to exempt ultra-Orthodox Jews from conscription, after the Supreme Court ruled that such exemptions were discriminatory. The court gave the government until April 1 to agree on an extension. Failing to meet this deadline, the Supreme Court instructed the government to suspend special education subsidies to those who fail to answer military call-ups.","Protest against the suspension of education subsidies, which members of the ultra-Orthodox community feel will be fatal to the finances of their education system. Protesters say this jeopardizes their faith, which they say is maintained through seminary education. Demonstrators also express concerns that this is the first step toward mandatory military service for the ultra-Orthodox community.",>100,Ultra-Orthodox community,1 month in March 2024; active since June 2024,"No policy/leadership change in response to the protests. The government announced on March 28 that it had not agreed on an extension to exempt ultra-Orthodox Jews from conscription. In June 2024, the Supreme Court ruled that there was no legal basis for the draft exemption. On July 2024, the government announced that it would begin drafting ultra-Orthodox men. In November 2024, the government began issuing the first draft orders despite ongoing protests.",Yes,No,Yes,No,No,Hundreds,No,No,No,No,No,Jerusalem,2024,3,01-03-24,172,30,100,2024,3,2024Q1,Normal,ultra-orthodox community,other
173,Colombia,Anti-Petro protests,Mar-24,Free,"Leftist Gustavo Petro was elected in 2022 on the promise to fight poverty and inequality and end Colombia's six decades of domestic conflict which has killed 450,000. Petro is struggling to maintain his governing coalition in Congress and his approval rating has declined amid an uptick in violence by rebels. He has proposed legislation to reform Colombia's healthcare system and turn a government agency into the sole administrator of insurance payouts, thereby sidelining private companies which make up a sizeable portion of insurance providers. Petro is also pushing a change to labor law to make it harder to hire workers on temporary contracts and require additional compensation for any work conducted after 6 p.m.","Protest political, economic, and social reforms backed by Petro, and demand action against deteriorating security situation. Express concerns with reforms to healthcare and labor laws which demonstrators say will set the country back decades.",">70,000",General public,1 month; 1 day in November 2024,No policy/leadership change in response to protests.,No,Yes,Yes,No,No,Tens of thousands,No,No,No,No,No,Bogotá,2024,3,01-03-24,173,30,70000,2024,3,2024Q1,Normal,general public,public
174,Peru,"""Dina is a murderer"" protest",24-Jan,Partly free,"President Dina Boluarte visited the southern region of Ayacucho, where ten people were killed in anti-government protests in 2022.",Denounce Boluarte's visit to the region and demand accountability.,>100,General public,1 day,No policy/leadership change in response to the protests. Protests continue as Boluarte faces a corruption probe.,No,No,Yes,No,No,Hundreds,No,No,No,No,No,Lima,2024,1,01-01-24,174,1,100,2024,1,2024Q1,Normal,general public,public
175,India,Protests to protect democracy,23-Dec,Partly free,"India has become increasingly autocratic under Prime Minister Narendra Modi, who has gone after the opposition on multiple occasions and suspended over a hundred opposition members of Parliament. Opposition leaders have faced arrests and investigation by federal agencies in the lead up to the 2024 election. They accuse Modi of election interference and using state agencies to further his political agenda.","Suspended opposition MPs expressed fear that India's democracy is in danger ahead of 2024 elections. On March 31, 2024, tens of thousands joined a ""Save Democracy"" rally organized by the Indian National Developmental Inclusive Alliance (INDIA) to call for free and fair elections and denounce harassment of the opposition.",">10,000",Opposition MPs; INDIA,1 day in 2023; 1 week in March 2023,No policy/leadership change in response to protest.,No,No,Yes,No,No,Tens of thousands,No,No,No,No,No,New Delhi,2023,12,01-12-23,175,1,10000,2023,12,2023Q4,Normal,opposition mps,political opposition
176,Kenya,End Femicide Now protest,24-Jan,Partly free,Recent rise in violence against women and femicide. At least 500 women have been killed in acts of femicide since 2016.,Demand an end to sexual and gender-based violence.,">1,000",Women,3 months,"No policy/leadership change in response to the protests other than the Directorate of Criminal Investigations rolling out new regulations requiring short-term rental properties to register with the Tourism Regulatory Authority, as two recent femicides occurred in unregistered short-term rentals.",No,No,No,No,Yes,Thousands,No,No,No,No,No,Nairobi,2024,1,01-01-24,176,90,1000,2024,1,2024Q1,Normal,women,women
177,Russia,Protest by soldiers' loved ones,23-Nov,Not free,Partial mobilization of Russian troops in September 2022 to fight in Ukraine.,Wives and loved ones of mobilized soldiers gathered in Moscow to demand their loved ones be either rotated out of Ukraine or fully demobilized.,>100,"Women, family of soldiers",4 months,"The government has repeatedly shut down these protests, but the movement remains active and has produced a manifesto calling for a one-year maximum term for conscription. Russia detained about twenty journalists, including a video journalist from Reuters, who were covering protests in February 2024, but they were released after several hours.",No,No,Yes,No,No,Hundreds,No,No,No,Yes,No,Moscow,2023,11,01-11-23,177,120,100,2023,11,2023Q4,Normal,"women, family of soldiers",women
178,Greece,Higher education reform protest,24-Jan,Free,Prime Minister Kyriakos Mitsotakis is expected to submit a bill to parliament which will permit private universities to operate in Greece.,"Oppose the decision to permit private universities to operate in Greece, claiming it will harm the public education system and devalue degrees from public universities.",">1,000",Students,3 months,"No policy/leadership change in response to the protests. In March 2024, Greek lawmakers approved a bill to end the state's monopoly on university education.",No,Yes,Yes,No,No,Thousands,No,No,Yes,No,No,Athens,2024,1,01-01-24,178,90,1000,2024,1,2024Q1,Normal,students,students/youth
179,Serbia,2023 election protests,23-Dec,Partly free,"The December 2023 parliamentary election, won by the Serbian Progressive Party, was called unfair by multiple international observers due to media bias favoring the ruling party, improper influence exerted by President Aleksandar Vučić, and irregularities such as vote buying.",Call for the election to be annulled due to irregularities.,">10,000","Students, opposition",4 months,"Serbia's parliament convened for the first time since the election on February 4, while the opposition continued to protest. Opposition lawmakers blew whistles and traded insults with Serbian Progressive Party lawmakers, claiming they stole the election. The Belgrade local elections will be rerun later in 2024.",No,No,Yes,No,No,Tens of thousands,No,No,No,Yes,No,Belgrade,2023,12,01-12-23,179,120,10000,2023,12,2023Q4,Normal,"students, opposition",students/youth
180,Democratic Republic of the Congo,Protest against the West,Feb-24,Not free,"Widespread violence and a Tutsi-led March 23 (M23) rebellion advancing toward Goma. Western countries provide support for Rwanda, which is accused of backing the Tutsi-led M23 rebellion in the Congo.","Express discontent with Western countries—namely, the United States, France, and Belgium—for their support of Rwanda. Demand that Westerners leave the country and stop financial assistance to Rwanda.",>100,General public,1 month,No policy/leadership change in response to protests. The United Nations already plans to withdraw peacekeepers from the region by the end of the year.,No,No,Yes,No,No,Hundreds,No,No,Yes,No,No,Kinshasa,2024,2,01-02-24,180,30,100,2024,2,2024Q1,Normal,general public,public
181,Kenya,Protest for the rule of law,24-Jan,Partly free,"President William Ruto declared his intention to disregard court orders, asserting that some justices have colluded with the opposition to obstruct the administration's agenda.","Demand Ruto respect the rule of law, and call for impeachment if he does not.",>10,Law Society of Kenya,1 month,No policy/leadership change in response to the protests.,No,No,Yes,No,No,Dozens,No,No,Yes,No,No,Nairobi,2024,1,01-01-24,181,30,10,2024,1,2024Q1,Normal,law society of kenya,other
182,Ecuador,Shutdown of Auca Petroecuador plant,23-Oct,Free,State-owned energy firm Petroecuador is extracting crude oil in Amazonian region of Ecuador without adequately compensating locals.,Demand Petroecuador pay for improved bridges and roads in the region.,">1,000",Auca community,3 months,No policy/leadership change in response to the protests. Petroecuador claims they are not responsible for goods provisions.,No,Yes,No,No,No,Thousands,No,No,No,No,No,Quito,2023,10,01-10-23,182,90,1000,2023,10,2023Q4,Normal,auca community,other
183,Bulgaria,Farmers' protest,23-Apr,Free,European Commission policies to allow Ukrainian farmers to export grains through EU countries—intended to counteract the reduction in grain exports caused by Russian blockades of Ukrainian Black Sea ports—resulted in a glut of Ukrainian grains in Bulgarian markets.,Anger over lowered prices of foreign grain imports and limited availability of local warehouses. Demand state compensation to offset high costs and falling income.,>100,Farmers,1 week in April 2023; 3 months between February 2024 to April 2024,"On April 28, 2023, the European Commission announced an agreement in principle with Bulgaria, Hungary, Poland, Romania, and Slovakia to provide €100 million in compensation to farmers and require that certain Ukrainian exports only enter those five countries in shipments already bound for another destination. The Bulgarian caretaker government disbursed €150 million in funds to compensate farmers facing low-cost competition from Ukrainian agriculture imports. In April 2024, the EU approved legislation that eased the environmental rules of the Common Agricultural Policy (CAP). In February 2024, the EU announced its ""Vision for Agriculture and Food,"" which laid out a blueprint to address many of the farmers' concerns.",No,Yes,Yes,No,No,Hundreds,Yes,No,No,No,No,Sofia,2023,4,01-04-23,183,7,100,2023,4,2023Q2,Normal,farmers,agriculture workers
184,Mexico,Protect Democracy protest,Feb-24,Partly free,"President Andrés Manuel López Obrador introduced a package of constitutional reforms to Congress that would overhaul the nation's electoral authority and the National Electoral Institute, and would require judges to be elected via popular vote.","Protesters decried the legislation, which they say undermines Mexican democracy.","<700,000",General public,1 day,No policy/leadership change in response to the protests.,No,No,Yes,No,No,Hundreds of thousands,No,Yes,No,No,No,Mexico City,2024,2,01-02-24,184,1,700000,2024,2,2024Q1,Normal,general public,public
185,Belgium,Farmers' protest 2024,24-Jan,Free,"Farmers' frustration about rising costs, EU environmental policies, and a plan for cheap food imports from outside the EU, which they fear will undercut their prices. The G20 Summit in November 2024 brought renewed attention to a prospective trade agreement between the EU and Mercosur trade bloc of South America.","Demand financial assistance to ensure the price of food reflects the additional costs European farmers face to comply with environmental regulation. As of November 2024, opposition to EU-Mercosur trade deal, which farmers argue will bring large agricultural imports that aren't bound by EU regulations and create unfair competition for EU farmers.",">1,000",Farmers,6 months; active since November 2024,"In April 2024, the EU approved legislation that eased the environmental rules of the Common Agricultural Policy (CAP). Despite opposition from farmers and certain EU countries (namely France), EU and South American officials reached a trade deal on December 6, 2024. In February 2024, the EU announced its ""Vision for Agriculture and Food,"" which laid out a blueprint to address many of the farmers' concerns.",Yes,Yes,No,No,No,Thousands,Yes,No,Yes,Yes,No,Brussels,2024,1,01-01-24,185,180,1000,2024,1,2024Q1,Outlier,farmers,agriculture workers
186,France,Farmers' protest 2024,24-Jan,Free,"Farmers cite frustration with government tax on tractor fuel, cheap agricultural imports, water storage issues, excessive restrictions, and red tape. The G20 Summit in November 2024 brought renewed attention to a prospective trade agreement between the EU and Mercosur trade bloc of South America.","Demand the enforcement of a law designed to safeguard farmgate prices, the continuation of diesel tax breaks for agricultural vehicles, immediate payout of EU agricultural subsidies, guarantees on insurance payouts related to health and climate, and immediate aid for winemakers and organic farmers. As of November 2024, opposition to EU-Mercosur trade deal, which farmers argue will bring large agricultural imports that aren't bound by EU regulations and create unfair competition for EU farmers.",">1,000",FNSEA farming union,7 months; active since November 2024,"The government scrapped plans to eliminate the diesel tax break for agricultural vehicles and announced a series of measures to ease financial and administrative burdens placed upon farmers.In February 2024, the EU announced its ""Vision for Agriculture and Food,"" which laid out a blueprint to address many of the farmers' concerns.",No,Yes,No,No,No,Thousands,Yes,No,No,Yes,No,Paris,2024,1,01-01-24,186,210,1000,2024,1,2024Q1,Outlier,fnsea farming union,labor unions
187,Germany,Farmers' protests,23-Dec,Free,Germany proposed cuts to diesel subsidies and tax breaks for agricultural vehicles.,Farmers fear this will threaten their livelihood.,>100,Farmers,3 months,"In March 2024, Germany's finance minister proposed a tax relief plan designed to appease farmers. In June 2024, the ruling coalition of the parliament agreed to introduce this relief package. In April 2024, the EU approved legislation that eased the environmental rules of the Common Agricultural Policy (CAP). In February 2024, the EU announced its ""Vision for Agriculture and Food,"" which laid out a blueprint to address many of the farmers' concerns.",No,Yes,No,No,No,Hundreds,Yes,No,No,No,No,Berlin,2023,12,01-12-23,187,90,100,2023,12,2023Q4,Normal,farmers,agriculture workers
