614,Chad,Military rule protests,21-Apr,Not free,The military’s seizure of power in the wake of the death of longtime president Idriss Déby.,Frustration with the military’s role in politics and the proposed long time frame to return the country to civilian rule.,">1,000",General public.,"7 months, intermittently, in 2021; 1.5 months in 2022 beginning in September",No policy/leadership change in response to protests.,No,No,Yes,No,No,Thousands,No,No,Yes,Yes,No,N'Djamena,2021,4,01-04-21,614,210,1000,2021,4,2021Q2,Outlier,general public.,public
615,Colombia,2021 tax proposal protests,21-Apr,Partly free,The government’s introduction of a proposal to raise tax rates and eliminate exemptions; a call for protests and strikes by the country’s main labor unions.,"Frustration with ongoing economic insecurity, a declining security situation, and pervasive inequality.",">10,000","Indigenous groups, labor unions, teachers, and university students.",5 months,"President Ivan Duque withdrew the tax proposal, and Finance Minister Alberto Carrasquilla resigned. A pared down version of the reform was passed in September 2021.",No,Yes,Yes,No,No,Tens of thousands,Yes,No,Yes,Yes,Yes,Bogota,2021,4,01-04-21,615,150,10000,2021,4,2021Q2,Outlier,"indigenous groups, labor unions, teachers, and university students.",labor unions
616,France,Anti-Semitic murder protest,21-Apr,Free,The Court of Cassation’s ruling that the killer of a Jewish woman could not be tried due to his “delirious state.”,"Frustration with the court’s determination amid rising anti-Semitic violence, and a sense of a lack of accountability for her death.",">1,000","General public, including high-level politicians.",1 day,No policy/leadership change in response to protest.,No,No,Yes,No,No,Thousands,No,No,No,No,No,Paris,2021,4,01-04-21,616,1,1000,2021,4,2021Q2,Normal,"general public, including high-level politicians.",public
617,North Macedonia,Opposition leader imprisonment protest,21-Apr,Partly free,Call by the opposition VMRO-DPMNE party for protests in response to over a dozen former party officials being sentenced to prison time for their role in a mob invasion of parliament in 2017.,A belief that the legal proceedings had been politically motivated; demands for a retrial.,">1,000","General public, including family members of imprisoned leaders.",1 day,No policy/leadership change in response to protest.,No,No,Yes,No,No,Thousands,No,No,No,No,No,Skopje,2021,4,01-04-21,617,1,1000,2021,4,2021Q2,Normal,"general public, including family members of imprisoned leaders.",public
618,Colombia,Police brutality protests,20-Sep,Partly free,Circulation of a video of police killing law student Javier Ordóñez by shooting him repeatedly with a stun gun.,Failure of the government to effectively address police brutality and violence.,">1,000",General public.,2 months,No policy or leadership change in response to the protests.,No,No,Yes,No,No,Thousands,No,No,Yes,No,No,Bogota,2020,9,01-09-20,618,60,1000,2020,9,2020Q3,Normal,general public.,public
619,Croatia,Coronavirus restriction protest,20-Sep,Free,"Imposition of coronavirus restrictions, including mask and vaccine mandates.",Skepticism of the coronavirus and a belief that public health restrictions jeopardized human rights.,">1,000","General public, especially antivaccine advocates.",5 months,No policy/leadership change in response to the protest.,No,No,Yes,No,No,Tens of thousands,No,No,Yes,Yes,No,Zagreb,2020,9,01-09-20,619,150,1000,2020,9,2020Q3,Outlier,"general public, especially antivaccine advocates.",public
620,Egypt,Friday of Anger protests,20-Sep,Not free,Call for protest by exiled opposition leader Mohamed Ali; the demolition of unlicensed homes; and increases in commodity pricing.,"Opposition to the entrenchment of the al-Sisi regime, high costs of living, and the lack of political pluralism.",">1,000","Rural citizens, especially those displaced by the government's demolition campaign.",2 weeks,No policy or leadership change in response to the protests.,No,Yes,Yes,Yes,No,Thousands,No,No,Yes,No,No,Cairo,2020,9,01-09-20,620,14,1000,2020,9,2020Q3,Normal,"rural citizens, especially those displaced by the government's demolition campaign.",other
621,Hungary,University independence protests,20-Sep,Partly free,The privatization of the University of Theater and Film Arts and the reorganization of its board under the control of an Orban ally.,"Frustration over increasing government control over higher education, restrictions on free expression, and declining academic freedom.",">5,000","General public, especially students.",2 months,No policy or leadership change in response to the protests.,No,No,Yes,No,No,Thousands,No,No,No,No,No,Budapest,2020,9,01-09-20,621,60,5000,2020,9,2020Q3,Normal,"general public, especially students.",students/youth
622,India,Farm bill protests,20-Sep,Partly free,Passage of bills on agricultural market reform and contract farming.,"Disruption of the rural farm economy, which has traditionally relied on middlemen to facilitate agricultural transactions.",">1,000,000",Farmers.,"2 years, intermittently.","In November 2021, Prime Minister Narendra Modi announced that his government would move to repeal the agricultural reform laws. Organizers called off protests after the government agreed to consider guaranteed prices for agricultural products.",No,Yes,No,No,No,Tens of millions,Yes,Yes,No,Yes,No,New Delhi,2020,9,01-09-20,622,730,1000000,2020,9,2020Q3,Normal,farmers.,agriculture workers
623,Venezuela,Service delivery protests,20-Sep,Not free,Collapse of gasoline supply chains and degradation of water and energy infrastructure.,"Frustration over the lack of meaningful state action in response to the economic collapse, government corruption, and dilapidated infrastructure.",">1,000","General public, especially those outside of the capital.",4 months,No policy or leadership change in response to the protests.,No,Yes,No,Yes,No,Thousands,No,No,No,Yes,No,Caracas,2020,9,01-09-20,623,120,1000,2020,9,2020Q3,Normal,"general public, especially those outside of the capital.",public
624,Bangladesh,Anti-rape protests,20-Oct,Partly free,Circulation of a video of sexual assault.,"An ongoing sense of impunity for rape and sexual assault perpetrators, especially directed at the state for failing to prosecute or impose significant penalties.",">10,000","General public, especially women and students.",1 week,"The government approved measures to impose the death penalty or lifetime ""rigorous imprisonment"" for rape.",No,No,Yes,No,Yes,Tens of thousands,Yes,No,No,No,No,Dhaka,2020,10,01-10-20,624,7,10000,2020,10,2020Q4,Normal,"general public, especially women and students.",students/youth
625,Georgia,Electoral protest,20-Oct,Partly free,Announcement of electoral results that showed the ruling Georgia Dream party with a significant lead.,"Belief that the electoral results were politically manipulated, that opposition parties had been deliberately kept out of power, and that oligarch and Georgia Dream founder Bidzina Ivanishvili retains an outsized level of influence.",">1,000","General public, especially opposition politicians.",3 weeks,No policy or leadership change in response to the protests.,No,No,Yes,No,No,Thousands,No,No,No,No,No,Tbilisi,2020,10,01-10-20,625,21,1000,2020,10,2020Q4,Normal,"general public, especially opposition politicians.",public
626,Indonesia,Jobs bill protests,20-Oct,Partly free,"Enactment of an omnibus Jobs Creation Bill, which reformed labor and market regulations.","Concern that reforms would weaken protections for workers, especially through reducing wages, insurance access, and pensions.",">1,000",General public.,1 month,No policy or leadership change in response to the protests.,No,Yes,Yes,No,No,Thousands,No,No,No,No,No,Jakarta,2020,10,01-10-20,626,30,1000,2020,10,2020Q4,Normal,general public.,public
627,Kyrgyzstan,Electoral protests,20-Oct,Not free,Allegations of vote-rigging and intimidation amid parliamentary elections.,Concern over the shrinking political space and lack of faith in electoral processes under President Sooronbai Jeenbekov.,">1,000",General public.,1 month,President Jeenbekov and his government resigned and were succeeded by an interim government led by opposition leader Sadyr Japarov.,No,No,Yes,No,No,Thousands,Yes,No,No,No,No,Bishkek,2020,10,01-10-20,627,30,1000,2020,10,2020Q4,Normal,general public.,public
628,Mexico,AMLO protests,20-Oct,Partly free,Perception that the government of President Andres Manuel Lopez Obrador has mismanaged the public health and economic crises stemming from the corronavirus pandemic.,"Economic frustration and broad-based opposition to the Lopez Obrador government, especially from conservatives.",">5,000","General public, especially conservatives and adherents of the FRENAAA, or National Anti-AMLO Front, movement.",2 months,No policy or leadership change in response to the protests.,No,No,Yes,No,No,Thousands,No,No,No,No,No,Mexico City,2020,10,01-10-20,628,60,5000,2020,10,2020Q4,Normal,"general public, especially conservatives and adherents of the frenaaa, or national anti-amlo front, movement.",public
629,Nigeria,SARS protests,20-Oct,Partly free,Circulation of a video of police brutality.,"Widespread belief that the police, especially the elite Special Anti-Robbery Squad (SARS), was involved in gross violations of human rights.",">10,000","General public, especially youth.",3 months,The government disbanded the SARS police squad and promised investigations into alleged human rights abuses.,No,No,Yes,No,No,Tens of thousands,Yes,No,Yes,No,No,Abuja,2020,10,01-10-20,629,90,10000,2020,10,2020Q4,Normal,"general public, especially youth.",students/youth
630,Pakistan,Opposition protests,20-Oct,Partly freee,Call by a coalition of opposition parties for protests against the government of Prime Minister Imran Khan.,"Corruption, influence of the military in domestic politics, and suspicion that the 2018 general election had been manipulated.",">10,000","General public, especially adherents of opposition political parties.",1 week,No policy or leadership change in response to the protests.,No,No,Yes,Yes,No,Tens of thousands,No,No,No,No,No,Islamabad,2020,10,01-10-20,630,7,10000,2020,10,2020Q4,Normal,"general public, especially adherents of opposition political parties.",public
631,Poland,Abortion rights protests,20-Oct,Free,"A ruling by Poland’s Constitutional Court that deemed abortion illegal in all cases except those involving rape, incest, or a threat to the mother’s life.",Anger at perceived restrictions on women’s rights and concern over political capture of the judiciary.,">5,000","General public, especially women.",4 months,No policy or leadership change in response to the protests.,No,No,Yes,No,Yes,Thousands,No,No,No,Yes,No,Warsaw,2020,10,01-10-20,631,120,5000,2020,10,2020Q4,Normal,"general public, especially women.",public
632,Armenia,Peace plan protests,20-Nov,Partly free,"Announcement of a Russian-brokered peace deal that ceded a sizable part of the contested Nagorno-Karabakh region to Azerbaijan; in May 2022, the government's announcement that it may have to reduce territorial claims as part of the peace process. In September 2022, a new offensive which resulted in further territorial losses for Armenia.","Nationalist sentiment and a belief in Armenian territorial claims to the Nagorno-Karabakh regions, and anger over concessions to Azerbaijan.",">10,000",Coalition of seventeen opposition parties and their adherents.,6 months in 2020–2021; 2 months from April–June 2022; 2 months from September–November 2022.,No policy or leadership change in response to the protests.,No,No,Yes,No,No,Tens of thousands,No,No,No,Yes,No,Yerevan,2020,11,01-11-20,632,180,10000,2020,11,2020Q4,Outlier,coalition of seventeen opposition parties and their adherents.,industrial workers
633,Cuba,Artistic freedom protests,20-Nov,Not free,"Arrest of rapper Denis Solis, who was later sentenced to eight months in prison for insulting a police officer.",Ongoing restrictions on artistic freedom and free expression.,>100,Members of the San Isidro Movement.,1 month,No policy or leadership change in response to the protests.,No,No,Yes,No,No,Hundreds,No,No,No,No,No,Havana,2020,11,01-11-20,633,30,100,2020,11,2020Q4,Normal,members of the san isidro movement.,other
634,France,Police security bill protests,20-Nov,Free,Approval in the Chamber of Deputies of a bill that limits the publication of images of on-duty police officers and the circulation of a video of police beating music producer Michel Zecler.,Concerns that the bill would limit accountability for police and suppress media freedom.,">100,000",General public.,4 months,The government agreed to rewrite the bill in response to protest demands.,No,No,Yes,No,No,Huundreds of thousands,No,Yes,No,Yes,No,Paris,2020,11,01-11-20,634,120,100000,2020,11,2020Q4,Normal,general public.,public
635,Guatemala,Budget protests,20-Nov,Partly free,"Adoption of a government budget bill that included spending cuts for public health, education, the judiciary, and social support programs while increasing stipends for lawmakers.","Widespread dissatisfaction with systemic corruption, weakening state support for vulnerable populations, and an ineffective government response to the coronavirus pandemic.",">5,000",General public.,1 month,The govermnent withdrew the budget bill.,No,No,Yes,Yes,No,Thousands,Yes,No,No,No,Yes,Guatemala City,2020,11,01-11-20,635,30,5000,2020,11,2020Q4,Normal,general public.,public
636,Peru,Impeachment protests,20-Nov,Partly free,A surprise vote by Peru’s opposition-led Congress to impeach and remove incumbent president Martin Vizcarra on the grounds of “moral incapacity.”,Anger that Congress would remove the popular president on dubious grounds in the midst of a national crisis.,">10,000",General public.,1 month,"Interim president Manuel Merino, a key supporter of the impeachment, resigned after only five days in office. He was succeeded by Francisco Sagasti.",No,No,Yes,Yes,No,Tens of thousands,Yes,No,No,No,No,Lima,2020,11,01-11-20,636,30,10000,2020,11,2020Q4,Normal,general public.,public
637,Slovakia,Coronavirus restrictions protest,20-Nov,Free,Ongoing pandemic-related restrictions and the commemoration of Slovenia’s national Fight for Freedom and Democracy Day.,Frustration with ongoing coronavirus restrictions.,">1,000","General public, especially far-right activists.",1 day,No policy or leadership change in response to the protests.,No,No,Yes,No,No,Thousands,No,No,No,No,Yes,Bratislava,2020,11,01-11-20,637,1,1000,2020,11,2020Q4,Normal,"general public, especially far-right activists.",public
638,Uganda,Opposition leader arrest protests,20-Nov,Not free,Arrest of opposition presidential candidates Bobi Wine and Patrick Amuriat.,"Opposition to the entrenchment of incumbent president Yoweri Museveni, lack of genuine political pluralism, and recurring crackdowns on political opposition.",">1,000","General public, especially supporters of Bobi Wine and Patrick Amuriat.",3 months,No policy or leadership change in response to the protests.,No,No,Yes,No,No,Thousands,No,No,Yes,No,No,Kampala,2020,11,01-11-20,638,90,1000,2020,11,2020Q4,Normal,"general public, especially supporters of bobi wine and patrick amuriat.",public
639,United States of America,Electoral protests,20-Nov,Free,Allegations leveled by President Donald Trump and his allies that vote counts were inaccurate and that there had been significant electoral fraud.,"Belief of Trump supporters that Democrats would steal the election, and the call of President-elect Joe Biden supporters for respecting the electoral process and the will of voters.",">1,000",Supporters of Trump and supporters of Biden.,3 months,No policy or leadership change in response to the protests.,No,No,Yes,No,No,Thousands,No,No,No,No,No,"Washington, D.C.",2020,11,01-11-20,639,90,1000,2020,11,2020Q4,Normal,supporters of trump and supporters of biden.,political group
640,Bulgaria,Coronavirus lockdown protest,20-May,Free,Enactment of lockdown measures to combat the spread of the coronavirus.,"Skepticism of the coronavirus and vaccines, and other concerns rooted in conspiracy theories and misinformation.",">1,000","Far-left activists, especially supporters of the Vazrazhdane group.",1 day,No policy or leadership change in response to the protest.,No,Yes,No,Yes,No,Tens of thousands,No,No,No,Yes,No,Sofia,2020,5,01-05-20,640,1,1000,2020,5,2020Q2,Normal,"far-left activists, especially supporters of the vazrazhdane group.",political group
641,Ecuador,Coronavirus protest,20-May,Partly free,Announcement of the closure of some state-owned companies and cuts to salaries of public sector workers.,Economic impacts of the coronavirus pandemic response.,4000,"Trade unions, social welfare organizations.",1 day,No policy/leadership change in response to the protest.,No,No,Yes,No,No,Tens of thousands,No,No,Yes,No,No,Quito,2020,5,01-05-20,641,1,4000,2020,5,2020Q2,Normal,"trade unions, social welfare organizations.",labor unions
642,`,Coronavirus protest,20-May,Free,"Protesters’ claims that the government misrepresented the extent of the health crisis, violated citizens’ rights by confining them to their homes and ruling by decree, and damaged the economy.","Economic effects of the lockdown, and concerns of government overreach.",Thousands,Pro-independence groups and their supporters.,1 day,No policy/leadership change in response to the protest.,No,Yes,Yes,No,No,Thousands,No,`,No,No,No,Madrid,2020,5,01-05-20,642,1,,2020,5,2020Q2,Normal,pro-independence groups and their supporters.,political group
643,Turkmenistan,Storm damage protest,20-May,Not free,Government failure to provide aid after a severe storm hit the city of Turkmenabat.,Frustration over poor service delivery and the government’s failure to address reconstruction needs after the storm.,">1,000",General public.,1 day,No policy/leadership change in response to protests.,No,No,Yes,No,No,Tens of thousands,No,No,Yes,Yes,No,Ashgabat,2020,5,01-05-20,643,1,1000,2020,5,2020Q2,Normal,general public.,public
644,United Kingdom,Coronavirus lockdown protests,20-May,Free,Enactment of lockdown measures to combat the spread of the coronavirus.,"Skepticism about the coronavirus and vaccines, and concerns over the balance between public health restrictions and freedom.",">10,000","General public, especially far-left and far-right activists, anti-vaxxers, and conspiracy theorists.","15 months, intermittently",No policy/leadership change in response to the protests.,No,No,Yes,No,No,Tens of thousands,No,No,No,Yes,Yes,London,2020,5,01-05-20,644,450,10000,2020,5,2020Q2,Outlier,"general public, especially far-left and far-right activists, anti-vaxxers, and conspiracy theorists.",public
645,United States of America,Police brutality protests,20-May,Free,Excessive use of lethal force by police officers against unarmed Black civilians.,"Ongoing police brutality toward communities of Black people, and broader issues of systemic racism.",">1,000,000",General public.,15 months,Multiple local governments have reduced funding for the police. Some of the officers involved in the deaths of George Floyd and Breonna Taylor have been arrested.,No,No,Yes,No,No,Over 1 million,Yes,Yes,Yes,Yes,No,"Washington, D.C.",2020,5,01-05-20,645,450,1000000,2020,5,2020Q2,Outlier,general public.,public
646,Brazil,Coronavirus protests,20-Mar,Free,"President Jair Bolsonaro’s poor and slow response to the coronavirus outbreak; and the death of George Floyd in the United States, sparking protests against local police brutality and racism.","Lack of an effective government response to the spread of the coronavirus, racism in Brazil, and police brutality against Black Brazilians.",">1,000",General public.,4 months,No policy/leadership change in response to the protests.,No,No,Yes,No,No,Thousands,No,No,Yes,No,No,Brasilia,2020,3,01-03-20,646,120,1000,2020,3,2020Q1,Normal,general public.,public
647,Colombia,Coronavirus protests,20-Mar,Partly free,"President Ivan Duque’s undermining of local and regional authorities, citizens’ claims that they were not receiving sufficient social support, and rising number of deaths from the virus.","Lack of an effective government response to the spread of the coronavirus, insufficient social support for marginalized and economically disadvantaged populations, and lack of protection for healthcare workers.",">1,000",General public.,8 months,No policy/leadership change in response to the protests.,No,Yes,Yes,No,No,Thousands,No,No,No,Yes,Yes,Bogota,2020,3,01-03-20,647,240,1000,2020,3,2020Q1,Outlier,general public.,public
648,Colombia,Prison protest,20-Mar,Partly free,"Unsanitary conditions in prisons, which could accelerate the spread of the coronavirus among inmates.","Unsanitary conditions in prisons, including overcrowding and lack of access to water.",Unknown,Prisoners.,1 day,"Colombia’s Ministry of Justice ordered the mass release of most nonviolent prisoners, so that they could temporarily serve their time at home.",No,No,Yes,No,No,Thousands,Yes,No,No,No,No,Bogota,2020,3,01-03-20,648,1,,2020,3,2020Q1,Normal,prisoners.,other
649,Israel,Israel coronavirus protests,20-Mar,Free,"Prime Minister Benjamin Netanyahu’s expansion of authority during the coronavirus outbreak, such as using phone surveillance technology, shutting down the court system, adjourning parliament, and planning to annex parts of the West Bank.","Perceptions of Netanyahu’s actions as antidemocratic, corrupt, or authoritarian.",">10,000",General public.,14 months,No policy/leadership change in response to the protests.,No,No,Yes,Yes,No,Tens of thousands,No,Yes,No,No,Yes,Jerusalem,2020,3,01-03-20,649,420,10000,2020,3,2020Q1,Outlier,general public.,public
650,Italy,Prison protest,20-Mar,Free,"Overcrowding in prisons during the coronavirus outbreak. Government decision to suspend or limit family visits to more than two dozen prisons for the next two weeks, due to coronavirus concerns.","Prison overcrowding, lack of government support for the prison system, and poor conditions in prisons.",Unknown,Prisoners.,1 day,No policy/leadership change in response to the protests.,No,Yes,Yes,No,No,Tens of thousands,No,No,No,No,No,Rome,2020,3,01-03-20,650,1,,2020,3,2020Q1,Normal,prisoners.,other
651,Lebanon,Prison protest,20-Mar,Partly free,Overcrowding in prisons during the coronavirus outbreak.,Overcrowding in Lebanese prisons.,Unknown,Prisoners.,1 day,No policy/leadership change in response to the protests.,No,Yes,Yes,Yes,No,Tens of thousands,No,No,No,No,No,Beirut,2020,3,01-03-20,651,1,,2020,3,2020Q1,Normal,prisoners.,other
652,Mexico,Femicide protests,20-Mar,Partly free,"In March 2020, triggered by the murder of a twenty-five-year-old woman and seven-year-old girl. In March 2022, protests were triggered by rising femicide rates and commemorations of International Women's Day. In March 2023, protests were triggered again by commemorations of International Women's Day.","Anger at violence against women, and lack of a government focus on addressing gender-based violence.",">10,000",Women.,3 weeks in March 2020; 1 day in March 2022; 1 day in March 2023,No policy or leadership change in response to the protests.,No,No,Yes,No,Yes,Thousands,No,No,Yes,No,No,Mexico City,2020,3,01-03-20,652,21,10000,2020,3,2020Q1,Normal,women.,women
653,Slovenia,Anti-Jansa protests,20-Mar,Free,"Allegations of corruption, illiberalism, and declining freedom under the government of Prime Minister Janez Jansa.",Frustration with rising illiberalism and poor governance under Jansa’s government.,">10,000",General public.,"16 months, intermittently",No policy/leadership change in response to protest.,No,No,Yes,Yes,No,Tens of thousands,No,No,No,Yes,Yes,Ljubljana,2020,3,01-03-20,653,480,10000,2020,3,2020Q1,Outlier,general public.,public
654,Australia,Racial equality protests,20-Jun,Free,"Death of George Floyd in the United States, sparking protests in Australia against local police brutality and racism.","Local issues of racism, institutional racism, and police violence against Aboriginal people.",">10,000",General public.,1 month,No policy/leadership change in response to the protests.,No,Yes,Yes,No,No,Thousands,Yes,No,No,No,No,Canberra,2020,6,01-06-20,654,30,10000,2020,6,2020Q2,Normal,general public.,public
655,Belarus,“Slipper uprising”,20-Jun,Not free,Arrests of opposition presidential candidates; anger over the fraudulence of the August 2020 presidential election.,Opposition to President Alexander Lukashenko’s reelection campaign; frustration over lack of genuine political pluralism.,">100,000",General public.,11 months,No policy/leadership change in response to the protests.,No,No,Yes,No,No,Hundreds of of thousands,No,Yes,Yes,Yes,No,Minsk,2020,6,01-06-20,655,330,100000,2020,6,2020Q2,Outlier,general public.,public
656,Democratic Republic of the Congo,Judiciary reform protests,20-Jun,Not free,"National Assembly’s proposed changes to the juidiciary that would include proposals to define the powers of judges, and its decision to appoint Ronsard Malonda as chairman of the Independent National Electoral Commission, despite his perceived past role in rigging elections in favor of former president Joseph Kabila.","Growing tensions within the ruling coalition, concern over the political influence of Kabila, and fears that the 2023 presidential election could be subject to manipulation with a new head of the national electoral commission.",">1,000","Supporters of President Felix Tshisekedi and his party, the Union for Democracy and Social Progress (UDPS).",1 month,No policy/leadership change in response to the protests.,No,No,Yes,No,No,Tens of thousands,No,No,No,No,No,Kinshasa,2020,6,01-06-20,656,30,1000,2020,6,2020Q2,Normal,"supporters of president felix tshisekedi and his party, the union for democracy and social progress (udps).",labor unions
